Hotel Name,Advertised Price,Total Price
Fairfield Inn by Marriott New York Manhattan/Times Square,The price is $269,$312 total
LaGuardia Plaza Hotel,The price is $269,$312 total
Courtyard by Marriott New York Manhattan/Midtown West,The price is $270,$313 total
Hotel Beacon,The price is $271,$317 total
Library Hotel by Library Hotel Collection,The price is $273,$341 total
6 Columbus Central Park Hotel,The price is $275,$354 total
"Hotel 50 Bowery, part of JdV by Hyatt",The price is $275,$354 total
The Marlton Hotel,The price is $277,$321 total
Aloft Harlem,The price is $278,$323 total
The Garden City Hotel,The price is $278,$338 total
The Iroquois New York,The price is $279,$355 total
The Frederick Hotel,The price is $279,$355 total
Casablanca Hotel by Library Hotel Collection,The price is $279,$349 total
Hyatt Regency JFK Airport at Resorts World New York,The price is $279,$352 total
Park Central Hotel New York,The price is $279,$368 total
Royalton New York,The price is $280,$365 total
The Lombardy Hotel,The price is $280,$336 total
Park Terrace Hotel,The price is $284,$329 total
"Crowne Plaza Times Square Manhattan, an IHG Hotel",The price is $284,$395 total
"The Time New York, part of JdV by Hyatt",The price is $285,$365 total
Condor Hotel,The price is $289,$335 total
Refinery Hotel,The price is $290,$382 total
Warwick New York,The price is $295,$375 total
The William Vale,The price is $295,$382 total
Courtyard by Marriott New York Manhattan/Times Square,The price is $296,$343 total
Dylan Hotel NYC,The price is $296,$360 total
The Hilton Club - New York,The price is $297,$344 total
HYATT house White Plains,The price is $297,$339 total
"The Algonquin Hotel Times Square, Autograph Collection",The price is $297,$374 total
"The Draper New York, Tapestry Collection by Hilton",The price is $297,$344 total
Ink 48 Hotel,The price is $299,$392 total
"InterContinental New York Barclay, an IHG Hotel",The price is $299,$394 total
Hampton Inn Manhattan/Times Square Central,The price is $299,$347 total
Inn at Great Neck,The price is $299,$334 total
Franklin Guesthouse,The price is $299,$347 total
Hotel Elysee by Library Hotel Collection,The price is $300,$372 total
Fairfield Inn & Suites New York Midtown Manhattan/Penn Station,The price is $302,$349 total
The Standard High Line,The price is $305,$388 total
Hotel Giraffe by Library Hotel Collection,The price is $305,$378 total
Residence Inn New York Manhattan/Central Park,The price is $305,$354 total
M Social Hotel Times Square New York,The price is $305,$389 total
Hilton Club The Quin New York,The price is $305,$354 total
Hilton Club The Central at 5th New York,The price is $305,$354 total
Best Western Plus Hospitality House,The price is $308,$357 total
The Standard East Village,The price is $309,$393 total
Virgin Hotels New York City,The price is $309,$397 total
W New York - Times Square,The price is $314,$389 total
Sofitel New York,The price is $314,$393 total
Made Hotel,The price is $328,$414 total
Radisson Hotel JFK Airport,The price is $329,$381 total
AC Hotel by Marriott New York Times Square,The price is $329,$381 total
Hilton Club West 57th Street New York,The price is $331,$383 total
Residence Inn by Marriott New York Manhattan/Times Square,The price is $332,$386 total
The Ned NoMad,The price is $333,$424 total
"Kimpton Hotel Eventi, an IHG Hotel",The price is $334,$422 total
LUMA Hotel Times Square,The price is $338,$391 total
The Gardens Sonesta ES Suites New York,The price is $338,$438 total
11 Howard,The price is $339,$433 total
Courtyard New York Manhattan/Times Square West,The price is $341,$395 total
Hyatt Place New York Midtown South,The price is $344,$398 total
The Benjamin Royal Sonesta New York,The price is $346,$447 total
"InterContinental New York Times Square, an IHG Hotel",The price is $349,$446 total
New York Marriott Downtown,The price is $351,$433 total
Merrion Row Hotel and Public House,The price is $351,$435 total
Courtyard by Marriott New York Manhattan/SoHo,The price is $359,$415 total
Sheraton New York Times Square Hotel,The price is $359,$445 total
W New York - Union Square,The price is $359,$416 total
Conrad New York Downtown,The price is $368,$428 total
Courtyard by Marriott New York Manhattan / Central Park,The price is $370,$428 total
New York Hilton Midtown,The price is $373,$466 total
Hotel AKA NoMad,The price is $375,$474 total
The Kimberly Hotel,The price is $379,$444 total
"Marriott Vacation Club Pulse, New York City",The price is $382,$442 total
The Knickerbocker Hotel,The price is $383,$494 total
The Maritime Hotel,The price is $388,$449 total
Hotel Hugo,The price is $389,$490 total
33 Seaport Hotel New York,The price is $389,$478 total
Castle Hotel & Spa,The price is $390,$446 total
Tempo by Hilton New York Times Square,The price is $397,$459 total
Hard Rock Hotel New York,The price is $399,$507 total
New York Marriott Marquis,The price is $404,$497 total
"The Cloud One New York-Downtown, by the Motel One Group",The price is $409,$473 total
Luxe Studio Suite with Charming Juliet Balcony,The price is $412,$591 total
Omni Berkshire Place,The price is $417,$517 total
1 Hotel Central Park,The price is $419,$536 total
1 Hotel Brooklyn Bridge,The price is $419,$536 total
Courtyard New York Manhattan/ Midtown East,The price is $427,$493 total
EVEN Hotel New York - Times Square South,The price is $429,$523 total
"Le Meridien New York, Central Park by Marriott",The price is $429,$496 total
Thompson Central Park - New York,The price is $438,$546 total
Courtyard by Marriott New York City Manhattan Fifth Avenue,The price is $449,$519 total
Courtyard by Marriott New York World Trade Center Area,The price is $449,$519 total
Park Lane New York,The price is $450,$576 total
The Wall Street Hotel,The price is $465,$537 total
Conrad New York Midtown,The price is $466,$539 total
Nine Orchard,The price is $469,$542 total
Corona Hotel,The price is $475,$549 total
Gansevoort Meatpacking,The price is $485,$595 total
The Times Square EDITION,The price is $491,$607 total
The Bowery Hotel,The price is $495,$572 total
"Deluxe King, Beautiful Oversized Room",The price is $499,$682 total
Elmhurst Hotel,The price is $499,$576 total
Lotte New York Palace,The price is $500,$577 total
Essence Express Wayne,The price is $501,$574 total
Loews Regency New York Hotel,The price is $509,$590 total
Sanctuary Hotel New York,The price is $510,$615 total
Pendry Manhattan West,The price is $510,$589 total
JW Marriott Essex House New York,The price is $512,$626 total
Mint House at 70 Pine,The price is $512,$591 total
Andaz 5th Avenue - a concept by Hyatt,The price is $533,$659 total
Superior King,The price is $539,$731 total
The New York EDITION,The price is $548,$667 total
Residence Inn by Marriott New York Manhattan/Midtown East,The price is $549,$635 total
The Dominick,The price is $555,$692 total
Superior King with Shared Balcony,The price is $569,$767 total
"The Chatwal, In The Unbound Collection By Hyatt",The price is $574,$662 total
Renaissance New York Midtown Hotel,The price is $589,$679 total
The Tillary Hotel,The price is $589,$704 total
The Wallace,The price is $599,$691 total
The Peninsula New York,The price is $633,$730 total
Deluxe Double Queen,The price is $649,$858 total
Deluxe Double Queen with Balcony,The price is $649,$865 total
2 x Grand Deluxe King at Royalton Park Avenue,The price is $651,$830 total
Trump International Hotel & Tower New York,The price is $675,$782 total
"The Langham, New York, Fifth Avenue",The price is $695,$803 total
The Mercer,The price is $695,$801 total
The Sherry Netherland,The price is $699,$806 total
NYC Adventure! Spacious Unit w/ Bathtub! Close to Empire State Building,The price is $713,$905 total
Casa Cipriani New York,The price is $720,$830 total
Four Seasons Hotel New York Downtown,The price is $720,$830 total
City Club Hotel,The price is $726,$861 total
Hyatt Centric Midtown 5th Avenue New York,The price is $739,$851 total
Equinox Hotel New York,The price is $743,$856 total
Luxury Junior Suite x Balcony and NYC view in the heart of Downtown Manhattan,The price is $749,"$1,006 total"
NYC Escape! Near to Iconic NYC Attractions! Swimming Pool & Rooftop Bar + Lounge,The price is $790,"$1,019 total"
"The Pierre, A Taj Hotel, New York",The price is $795,$950 total
Hotel Barriere Fouquets New York,The price is $800,$954 total
The St. Regis New York,The price is $806,$978 total
"The Ritz-Carlton New York, NoMad",The price is $825,$950 total
Baccarat Hotel and Residences New York,The price is $845,$973 total
Top Notch 2BR & 2BA Suite Minutes From Central Park in Upper East Side,The price is $870,"$1,255 total"
Top Notch 2 Bedroom Suite Minutes From Central Park,The price is $870,"$1,255 total"
Top Notch 2 Bedroom Minutes From Central Park,The price is $870,"$1,255 total"
ModernHaus SoHo,The price is $879,"$1,064 total"
"The Ritz-Carlton New York, Central Park",The price is $925,"$1,065 total"
"Mandarin Oriental, New York",The price is $955,"$1,099 total"
The Historic Blue Moon Hotel - NYC,The price is $967,"$1,148 total"
The Plaza Hotel,The price is $995,"$1,220 total"
Quintessential King with Balcony,The price is $999,"$1,329 total"
Luxury Family Suite with Patio,The price is $999,"$1,323 total"
Baymont by Wyndham White Plains - Elmsford,The price is $999,"$1,143 total"
"The Carlyle, A Rosewood Hotel","The price is $1,020","$1,174 total"
The Lowell,"The price is $1,060","$1,222 total"
The Mark,"The price is $1,115","$1,283 total"
The Towers at Lotte New York Palace,"The price is $1,120","$1,289 total"
Chelsea Hotel Room King Bed,"The price is $10,000","$10,904 total"
Hotel 32 32,We are sold out,We are sold out
Chelsea Savoy Hotel,We are sold out,We are sold out
Walker Hotel Tribeca,We are sold out,We are sold out
The Jane Hotel,We are sold out,We are sold out
NobleDEN Hotel,We are sold out,We are sold out
San Carlos Hotel,We are sold out,We are sold out
Hudson River Hotel,We are sold out,We are sold out
Hyatt Place New York City/Times Square,We are sold out,We are sold out
Cachet Boutique New York,We are sold out,We are sold out
Roxy Hotel New York,We are sold out,We are sold out
Hyatt Centric Times Square New York,We are sold out,We are sold out
Soho Grand Hotel,We are sold out,We are sold out
Doxie Hotel,We are sold out,We are sold out
"Park South Hotel, part of JdV by Hyatt",We are sold out,We are sold out
Hyatt Place New York/Chelsea,We are sold out,We are sold out
The Hotel Chelsea,We are sold out,We are sold out
Hotel 309,Unavailable,Unavailable
Chelsea Pines Inn,We are sold out,We are sold out
Club Wyndham Midtown 45,Unavailable,Unavailable
The Moore,We are sold out,We are sold out
St Marks Hotel,We are sold out,We are sold out
Ramada by Wyndham New York Times Square West,We are sold out,We are sold out
Night Hotel Broadway,We are sold out,We are sold out
WestHouse New York,Unavailable,Unavailable
SpringHill Suites by Marriott New York Midtown Manhattan/Park Avenue,We are sold out,We are sold out
Hilton Garden Inn New York Times Square South,We are sold out,We are sold out
Walker Hotel Greenwich Village,We are sold out,We are sold out
Untitled at 3 Freeman Alley,We are sold out,We are sold out
Hyatt Union Square New York,We are sold out,We are sold out
Kasa The Duffy Times Square,Unavailable,Unavailable
The Herald Hotel Powered by LuxUrban,We are sold out,We are sold out
The Wagner,We are sold out,We are sold out
TBA Times Square,We are sold out,We are sold out
SIXTY SoHo,We are sold out,We are sold out
"The Beekman, A Thompson Hotel",We are sold out,We are sold out
AKA Central Park,Unavailable,Unavailable
"The Beekman Tower, Trademark Collection by Wyndham",Unavailable,Unavailable
Travel Inn Hotel,We are sold out,We are sold out
The FIDI Hotel,We are sold out,We are sold out
The Hotel 91,We are sold out,We are sold out
Wellington Hotel,We are sold out,We are sold out
"Blue Angel Hotel NYC, Ascend Hotel Collection",We are sold out,We are sold out
Sonder The William,We are sold out,We are sold out
Sonder Henri on 24,We are sold out,We are sold out
JG Sohotel,We are sold out,We are sold out
AKA Times Square,Unavailable,Unavailable
Windsor Hotel,We are sold out,We are sold out
Hotel Five44,Unavailable,Unavailable
Best Western Premier Herald Square,We are sold out,We are sold out
Radio City Apartments,We are sold out,We are sold out
The Gregorian,We are sold out,We are sold out
Incentra Village Hotel,Unavailable,Unavailable
Sonder at One Platt,We are sold out,We are sold out
Sonder Chambers,We are sold out,We are sold out
Stewart Hotel,We are sold out,We are sold out
Clarion Hotel Park Avenue,We are sold out,We are sold out
Night Hotel by SB at Times Square,We are sold out,We are sold out
The Mansfield Hotel,We are sold out,We are sold out
Mayfair New York,We are sold out,We are sold out
East Village Hotel,We are sold out,We are sold out
The Blakely Hotel Powered by LuxUrban,We are sold out,We are sold out
The Redbury New York,We are sold out,We are sold out
Sanctuary NYC Retreats,We are sold out,We are sold out
The Inn at Irving Place,We are sold out,We are sold out
Marrakech New York,We are sold out,We are sold out
Down Town Association,We are sold out,We are sold out
31 Street Broadway Hotel,We are sold out,We are sold out
Hotel Stanford,We are sold out,We are sold out
Sonder Battery Park,We are sold out,We are sold out
Macy Empire Apartments,Unavailable,Unavailable
The Broome Nyc,We are sold out,We are sold out
Sonder City Hall Park,We are sold out,We are sold out
NYC Empire Apartments,Unavailable,Unavailable
The Roger Smith Hotel,We are sold out,We are sold out
Kasa Lantern Lower East Side,Unavailable,Unavailable
Hotel Plaza Athenee,We are sold out,We are sold out
Motto By Hilton New York City Times Square,We are sold out,We are sold out
Studios Midtown Manhattan,We are sold out,We are sold out
Graduate New York,We are sold out,We are sold out
Econo Lodge Times Square,We are sold out,We are sold out
AKA Sutton Place,We are sold out,We are sold out
The Nomad Suites & Apartments,Unavailable,Unavailable
Riff Hotel Chelsea,We are sold out,We are sold out
Hotel Shocard at Times Square,We are sold out,We are sold out
NEW The Gramercy Park Studios,We are sold out,We are sold out
TownePlace Suites by Marriott New York Manhattan,We are sold out,We are sold out
Candy Hostel,We are sold out,We are sold out
Sonder Duane Street,We are sold out,We are sold out
Gramercy Park Hotel,We are sold out,We are sold out
The Surrey,We are sold out,We are sold out
Excelsior Hotel,We are sold out,We are sold out
The Residences by Hilton Club,We are sold out,We are sold out
Oakwood at CAMEO,We are sold out,We are sold out
GEM Hotel - Chelsea,We are sold out,We are sold out
Ymca Harlem,We are sold out,We are sold out
Sonder Flatiron,We are sold out,We are sold out
Best Western Bowery Hanbee Hotel,We are sold out,We are sold out
Murray Hill East,We are sold out,We are sold out
Gem Hotel Soho,We are sold out,We are sold out
Cassa Hotel NY 45th Street,We are sold out,We are sold out
Royal Park,We are sold out,We are sold out
AKA Wall Street,We are sold out,We are sold out
Nomad Design House,We are sold out,We are sold out
FABE Suites Flat Iron,We are sold out,We are sold out
Oakwood at TRIBECA HOUSE,We are sold out,We are sold out
New World Hotel,We are sold out,We are sold out
Studios in New York,Unavailable,Unavailable
Sonder at The Nash,We are sold out,We are sold out
Artel Hotel by The Red Collection Times Square,We are sold out,We are sold out
Park Hyatt New York,We are sold out,We are sold out
Pestana CR7 Times Square,We are sold out,We are sold out
Hyatt House New York Chelsea,We are sold out,We are sold out
Collective Governors Island,We are sold out,We are sold out
45 Times Square Hotel,We are sold out,We are sold out
Nyma The New York Manhattan Hotel,We are sold out,We are sold out
Jazz On The Park Hostel,We are sold out,We are sold out
The Washington by Luxurban,We are sold out,We are sold out
Spacious and Historic Duplex Apartment,We are sold out,We are sold out
5th & 55th Residence Club,We are sold out,We are sold out
Central Park West Hostel,We are sold out,We are sold out
Nap York Central Park Sleep Station,We are sold out,We are sold out
Harlem YMCA,We are sold out,We are sold out
Kama Central Park Hostel,We are sold out,We are sold out
Da Vinci Hotel,We are sold out,We are sold out
110th Boutique Hotel,We are sold out,We are sold out
Rostel- Hostel,We are sold out,We are sold out
Incentra Home Chelsea,Unavailable,Unavailable
Manhattan Private Bedroom Hostel,We are sold out,We are sold out
Manhattan Bowery Lodge,Unavailable,Unavailable
U Hotel Fifth Avenue,We are sold out,We are sold out
EC New Yorker Student Residence,We are sold out,We are sold out
The Wilshire Grand Hotel,We are sold out,We are sold out
John Hotel,We are sold out,We are sold out
Hyatt Place Fort Lee / George Washington Bridge,We are sold out,We are sold out
Clinton Inn Hotel & Event Center,We are sold out,We are sold out
West Gate Inn Nyack,We are sold out,We are sold out
Hyatt House Jersey City,Unavailable,Unavailable
Nesva Hotel,We are sold out,We are sold out
SureStay Hotel by Best Western Secaucus Meadowlands,We are sold out,We are sold out
Hotel RL Brooklyn,We are sold out,We are sold out
Armoni Inn & Suites,We are sold out,We are sold out
Inn at Jericho,Unavailable,Unavailable
Hyatt Place New York/Yonkers,We are sold out,We are sold out
Monti Hotel,We are sold out,We are sold out
APA Hotel Woodbridge,We are sold out,We are sold out
Comfort Inn & Suites,We are sold out,We are sold out
Hotel Nirvana,We are sold out,We are sold out
"Holiday Inn LIC LaGuardia West, an IHG Hotel",We are sold out,We are sold out
Delamar Greenwich Harbor,We are sold out,We are sold out
"Red Carpet Inn Newark Irvington, NJ",We are sold out,We are sold out
Best Western Plus Fairfield Executive Inn,We are sold out,We are sold out
Best Western Plus Plaza Hotel,We are sold out,We are sold out
Pointe Plaza Hotel,Unavailable,Unavailable
"Hotel Nyack, a JdV by Hyatt Hotel",We are sold out,We are sold out
The Mansion at Glen Cove,We are sold out,We are sold out
Best Western Plus Brooklyn Bay Hotel,We are sold out,We are sold out
Turkey Hill Inn,We are sold out,We are sold out
"Robert Treat Hotel, BW Premier Collection",We are sold out,We are sold out
Ramada by Wyndham Yonkers / Westchester,We are sold out,We are sold out
The Vanderbilt Hotel Suites,We are sold out,We are sold out
Hyatt Regency Jersey City on the Hudson,We are sold out,We are sold out
The Baltic Hotel,We are sold out,We are sold out
Hotel Le Bleu,We are sold out,We are sold out
WoodSpring Suites Linden,Unavailable,Unavailable
Sleep Inn Long Island City - Manhattan View,We are sold out,We are sold out
The George,We are sold out,We are sold out
Bellerose Inn,We are sold out,We are sold out
The Modernist Hotel,We are sold out,We are sold out
Super 8 by Wyndham Nyack NY,We are sold out,We are sold out
Hilton New York JFK Airport,We are sold out,We are sold out
Hotel BPM - Brooklyn New York,We are sold out,We are sold out
Cresthaven Inn JFK,Unavailable,Unavailable
Tremont Hotel,We are sold out,We are sold out
Super 8 by Wyndham Bronx Near Botanical Garden,We are sold out,We are sold out
Swan Motel,We are sold out,We are sold out
