Hotel Name,Advertised Price,Total Price
Days Inn by Wyndham Wayne,The price is $63,$72 total
Bowery Grand Hotel,The price is $71,$85 total
Days Inn by Wyndham Iselin / Woodbridge,The price is $77,$89 total
Tides Motor Inn at Stehli Beach,The price is $79,$88 total
Canal Loft Hotel,The price is $81,$126 total
Rodeway Inn Capri,The price is $85,$100 total
Sky Hotel Flushing/LaGuardia Airport,The price is $89,$110 total
Chelsea Inn,The price is $90,$176 total
Days Inn by Wyndham Nanuet / Spring Valley,The price is $92,$102 total
Super 8 by Wyndham North Bergen NJ/NYC Area,The price is $93,$109 total
Best Western Queens Court Hotel,The price is $93,$111 total
Ramada by Wyndham East Orange,The price is $93,$104 total
Ramada by Wyndham Staten Island,The price is $94,$112 total
Flushing Hotel,The price is $95,$113 total
Super 8 by Wyndham Meadowlands,The price is $95,$112 total
Howard Johnson by Wyndham North Bergen,The price is $98,$115 total
Hotel Executive Suites,The price is $98,$112 total
Red Roof Inn PLUS+ Newark Liberty Airport - Carteret,The price is $98,$113 total
The Central Park North,The price is $99,$117 total
Howard Johnson Hotel by Wyndham Newark Airport,The price is $99,$114 total
La Quinta Inn & Suites by Wyndham Fairfield NJ,The price is $101,$116 total
Best Western The Inn At Ramsey,The price is $101,$116 total
Days Hotel by Wyndham North Bergen /NYC Area,The price is $101,$119 total
"Avion Inn Near LGA Airport, Ascend Hotel Collection",The price is $102,$121 total
TRYP by Wyndham Newark Downtown,The price is $103,$119 total
Extended Stay America Suites Ramsey Upper Saddle River,The price is $104,$120 total
Horizon Inn,The price is $105,$120 total
Off Soho Suites Hotel,The price is $106,$127 total
The Ridge Hotel,The price is $108,$197 total
"Staypineapple, An Artful Hotel, Midtown",The price is $109,$157 total
Hotel Mulberry,The price is $109,$129 total
Queens Hotel,The price is $109,$130 total
The One Boutique Hotel,The price is $109,$129 total
Ramada by Wyndham Rochelle Park Near Paramus,The price is $109,$125 total
Wyndham Garden LaGuardia South,The price is $110,$129 total
Days Inn by Wyndham Ridgefield NJ,The price is $111,$130 total
Red Roof Inn PLUS+ Secaucus - Meadowlands - NYC,The price is $112,$132 total
Leon Hotel LES,The price is $113,$158 total
Hotel Mimosa,The price is $113,$133 total
The Park Ave North,The price is $115,$135 total
Comfort Inn Manhattan - Midtown West,The price is $116,$137 total
Extended Stay America Suites Newark Woodbridge,The price is $119,$136 total
Liberty View Brooklyn hotel,The price is $119,$140 total
Grandview Hotel New York,The price is $119,$140 total
Radio Hotel,The price is $119,$140 total
Asiatic Hotel by LaGuardia Airport,The price is $119,$140 total
Knights Inn Brooklyn Sunset Park,The price is $119,$144 total
DoubleTree by Hilton New York Downtown,The price is $120,$141 total
Hampton Inn & Suites Newark Airport Elizabeth,The price is $121,$142 total
Howard Johnson by Wyndham Clifton NJ,The price is $121,$139 total
Hampton Inn Manhattan/Downtown-Financial District,The price is $121,$143 total
Best Western Brooklyn-Coney Island Inn,The price is $122,$144 total
Extended Stay America Suites Elizabeth Newark Airport,The price is $123,$145 total
LIC Hotel,The price is $124,$145 total
Paris Suites Hotel,The price is $125,$147 total
The Manhattan at Times Square Hotel,The price is $125,$187 total
Super Lake Hotel,The price is $126,$148 total
"Holiday Inn Express Hotel & Suites Meadowlands Area, an IHG Hotel",The price is $126,$148 total
Comfort Inn Paramus,The price is $127,$145 total
Super 8 by Wyndham Long Island City LGA Hotel,The price is $127,$150 total
Quality Suites NYC Gateway,The price is $128,$150 total
Americana Inn,The price is $129,$166 total
Red Roof Inn Fairfield,The price is $130,$149 total
Hotel Richland LES,The price is $131,$173 total
"Crowne Plaza Newark Airport, an IHG Hotel",The price is $131,$150 total
Red Carpet Inn Elmwood Park,The price is $132,$151 total
Best Western Plus Newark Airport West,The price is $133,$153 total
Hyatt Place Fair Lawn Paramus,The price is $133,$152 total
Extended Stay America Suites Meadowlands Rutherford,The price is $133,$156 total
Fairfield Inn by Marriott East Rutherford Meadowlands,The price is $134,$158 total
The Parc Hotel,The price is $135,$159 total
Hampton Inn Manhattan-Seaport-Financial District,The price is $136,$160 total
Mitchell Executive Hotel,The price is $137,$157 total
Fairfield Inn & Suites New York Queens/Fresh Meadows,The price is $137,$161 total
"Holiday Inn Express & Suites Jersey City - Holland Tunnel, an IHG Hotel",The price is $138,$161 total
Pod 51,The price is $139,$186 total
SoHo 54 Hotel,The price is $139,$197 total
Meadowlands Plaza Hotel,The price is $139,$163 total
Opera House Hotel,The price is $139,$180 total
Ardsley Acres Hotel Westchester,The price is $139,$159 total
Ramada by Wyndham Rockville Centre,The price is $141,$158 total
"Holiday Inn Hasbrouck Heights-Meadowlands, an IHG Hotel",The price is $142,$163 total
Extended Stay America Suites Secaucus Meadowlands,The price is $142,$168 total
Extended Stay America Suites Secaucus New York City Area,The price is $142,$168 total
The Floral Park Motor Lodge,The price is $143,$163 total
Wyndham Garden Brooklyn Sunset Park,The price is $143,$178 total
The Lex NYC,The price is $144,$202 total
TRYP by Wyndham New York City Times Square / Midtown,The price is $144,$191 total
Orchard Street Hotel,The price is $144,$183 total
Comfort Suites Newark - Harrison,The price is $144,$165 total
Hampton Inn & Suites Teaneck Glenpointe,The price is $144,$165 total
Comfort Inn Prospect Park - Brooklyn,The price is $144,$168 total
The Solita Soho Hotel,The price is $144,$192 total
Feather Factory,The price is $144,$169 total
Residence Inn by Marriott East Rutherford Meadowlands,The price is $144,$169 total
Courtyard by Marriott Newark Liberty International Airport,The price is $144,$166 total
Best Western Jamaica Inn,The price is $144,$169 total
SpringHill Suites by Marriott Newark Liberty International,The price is $145,$167 total
Best Western Queens Gold Coast,The price is $145,$170 total
Cambria Hotel New York - Chelsea,The price is $146,$171 total
Millennium Hilton New York One UN Plaza,The price is $146,$201 total
Ramada by Wyndham Jersey City,The price is $146,$170 total
Hampton Inn Manhattan Grand Central,The price is $148,$173 total
"Holiday Inn Express Newark Airport Elizabeth, an IHG Hotel",The price is $148,$170 total
Hampton Inn Newark Airport,The price is $149,$171 total
The Gallivant Times Square,The price is $149,$192 total
The Shoreham Hotel,The price is $149,$186 total
Sonesta Simply Suites Nanuet,The price is $149,$166 total
Hilton Garden Inn New York/Midtown Park Ave,The price is $149,$175 total
"Holiday Inn Express New York - Manhattan West Side, an IHG Hotel",The price is $151,$179 total
"Holiday Inn Express Brooklyn - Bushwick, an IHG Hotel",The price is $151,$196 total
Fairfield Inn & Suites Newark Liberty International Airport,The price is $152,$175 total
Red Lion Inn & Suites Long Island City,The price is $152,$178 total
Marriott Saddle Brook,The price is $152,$174 total
Courtyard by Marriott Yonkers Westchester County,The price is $152,$175 total
Paramount Times Square,The price is $152,$218 total
Freehand New York,The price is $152,$212 total
Fairfield Inn & Suites New York Manhattan/Downtown East,The price is $152,$178 total
La Quinta Inn & Suites by Wyndham Secaucus Meadowlands,The price is $152,$179 total
The Boro Hotel,The price is $152,$200 total
Casa Azul Hotel Blu JFK,The price is $152,$190 total
Fairfield Inn & Suites by Marriott North Bergen,The price is $152,$179 total
DoubleTree by Hilton New York Midtown Fifth Ave,The price is $152,$178 total
"The Westfield Inn, BW Signature Collection",The price is $152,$170 total
Hampton Inn Brooklyn/Downtown,The price is $152,$178 total
Fairfield Inn New York Manhattan/Financial District,The price is $152,$178 total
Eurostars Wall Street,The price is $153,$179 total
La Quinta Inn & Suites by Wyndham New York City Central Park,The price is $153,$212 total
Hilton Meadowlands,The price is $154,$181 total
Placemakr Wall Street,The price is $154,$282 total
HGU New York,The price is $154,$180 total
Wyndham Garden North Bergen Near Secaucus,The price is $154,$182 total
Royal Regency Hotel,The price is $155,$188 total
DoubleTree by Hilton New York Times Square West,The price is $156,$182 total
Travelodge by Wyndham Manhasset,The price is $156,$174 total
"Hotel Indigo - NYC Downtown - Wall Street, an IHG Hotel",The price is $157,$214 total
Union Hotel,The price is $157,$186 total
Edge Hotel,The price is $158,$184 total
Courtyard by Marriott New York Downtown Manhattan/Financial District,The price is $158,$184 total
Quality Inn JFK Airport Rockaway Blvd,The price is $158,$188 total
Fitzpatrick Grand Central,The price is $158,$208 total
The Wall Street Inn,The price is $158,$185 total
Pod Times Square,The price is $159,$209 total
The Hotel @ Fifth Avenue,The price is $159,$206 total
"EVEN Midtown East Grand Central, an IHG Hotel",The price is $159,$213 total
Midtown West Hotel,The price is $159,$201 total
Heritage Hotel,The price is $159,$186 total
Lic Plaza Hotel,The price is $159,$186 total
Hotel Riu Plaza New York Times Square,The price is $159,$219 total
"Holiday Inn New York City - Wall Street, an IHG Hotel",The price is $161,$207 total
La Quinta Inn & Suites by Wyndham Times Square South,The price is $161,$210 total
DoubleTree by Hilton Hotel Newark Airport,The price is $161,$185 total
Hampton Inn Carlstadt-At The Meadowlands,The price is $161,$189 total
"Club Quarters Hotel, Grand Central",The price is $161,$188 total
Hotel Boutique at Grand Central,The price is $161,$188 total
Artezen Hotel,The price is $161,$204 total
Wyndham Garden Long Island City,The price is $161,$188 total
Extended Stay America Suites Meadowlands East Rutherford,The price is $161,$190 total
YMCA West Side,The price is $162,$162 total
Best Western Premier Empire State Hotel,The price is $162,$189 total
"Holiday Inn Express Ramsey-Mahwah, an IHG Hotel",The price is $162,$186 total
Hilton Newark Airport,The price is $162,$186 total
NU Hotel Brooklyn,The price is $163,$208 total
"Viana Hotel and Spa, Trademark Collection by Wyndham",The price is $163,$182 total
The Shelburne Sonesta New York,The price is $164,$237 total
Aloft Manhattan Downtown - Financial District,The price is $164,$192 total
Best Western Mill River Manor,The price is $165,$184 total
The Lodge Red Hook,The price is $165,$193 total
Wheeler Hotel,The price is $167,$195 total
Pod 39,The price is $169,$220 total
Sheraton Tribeca New York Hotel,The price is $169,$197 total
Adria Hotel And Conference Center,The price is $169,$197 total
Airway Inn at LaGuardia,The price is $169,$197 total
Four Points By Sheraton New York Downtown,The price is $169,$198 total
Residence Inn by Marriott New York Downtown Manhattan/Financial District,The price is $169,$198 total
The Gatsby Hotel,The price is $169,$230 total
Home2 Suites by Hilton Newark Airport,The price is $169,$195 total
Midtown Convention Center Hotel,The price is $170,$214 total
"Hotel Indigo NYC Financial District, an IHG Hotel",The price is $170,$201 total
Broadway Plaza Hotel,The price is $170,$210 total
Westminster Hotel,The price is $170,$195 total
The Brooklyn,The price is $170,$221 total
Fairfield Inn by Marriott JFK Airport,The price is $170,$199 total
"The L Hotel, Ascend Hotel Collection",The price is $171,$200 total
Ravel Hotel Trademark Collection by Wyndham,The price is $172,$201 total
Hampton Inn Nanuet,The price is $174,$194 total
Red Roof PLUS+ Long Island - Garden City,The price is $174,$194 total
Hilton Short Hills,The price is $174,$200 total
Fairfield Inn by Marriott New York Manhattan/Fifth Avenue,The price is $175,$204 total
SpringHill Suites by Marriott Tarrytown Westchester County,The price is $175,$200 total
Hilton Garden Inn NYC Financial Center/Manhattan Downtown,The price is $175,$205 total
Best Western Gregory Hotel,The price is $175,$205 total
Wingate by Wyndham New York Midtown South/5th Ave,The price is $176,$205 total
Extended Stay America Suites New York City LaGuardia Airport,The price is $176,$205 total
Margaritaville Resort Times Square,The price is $176,$263 total
YOTEL New York Times Square,The price is $176,$249 total
DoubleTree by Hilton Hotel New York City - Chelsea,The price is $177,$206 total
Hilton Garden Inn New York/West 35th Street,The price is $177,$206 total
The Kenilworth,The price is $177,$203 total
DoubleTree by Hilton Hotel & Suites Jersey City,The price is $178,$207 total
Redford Hotel,The price is $179,$224 total
Sleepy Hollow Hotel,The price is $179,$205 total
Best Western Paramus Hotel & Suites,The price is $179,$205 total
Aloft Long Island City - Manhattan View,The price is $179,$209 total
Residence Inn by Marriott Newark Elizabeth/Liberty International Airport,The price is $179,$210 total
Ameritania Hotel at Times Square,The price is $179,$232 total
Empire Hotel,The price is $179,$232 total
Aliz Hotel Times Square,The price is $179,$243 total
Moderne Hotel,The price is $179,$232 total
Moxy NYC Times Square,The price is $179,$243 total
Residence Inn By Marriott New Rochelle,The price is $179,$205 total
La Quinta Inn & Suites by Wyndham Garden City,The price is $180,$200 total
"EVEN Hotel Brooklyn, an IHG Hotel",The price is $180,$227 total
Four Points by Sheraton Manhattan - Chelsea,The price is $180,$210 total
The Fifty Sonesta Select New York,The price is $180,$257 total
"Holiday Inn Express & Suites Jersey City North - Hoboken, an IHG Hotel",The price is $180,$210 total
Best Western Fort Lee,The price is $181,$209 total
Executive Class at MTS Hotel,The price is $181,$247 total
Hyatt Place Secaucus/Meadowlands,The price is $182,$214 total
Hyatt Herald Square New York,The price is $182,$235 total
The Gotham Hotel,The price is $183,$241 total
Courtyard by Marriott New York Queens/Fresh Meadows,The price is $184,$215 total
The Flat NYC,The price is $185,$215 total
Hampton Inn New York Times Square,The price is $185,$216 total
Home2 Suites By Hilton New York Times Square,The price is $185,$216 total
Comfort Inn JFK Airport,The price is $185,$216 total
Hilton Garden Inn Roslyn,The price is $186,$208 total
RIU Plaza Manhattan Times Square,The price is $187,$252 total
Sonesta White Plains Downtown,The price is $187,$235 total
Hotel St. James,The price is $188,$219 total
Citadines Connect Fifth Avenue New York,The price is $188,$242 total
Millennium Downtown New York,The price is $188,$254 total
Henn na Hotel New York,The price is $188,$242 total
The Allen Hotel,The price is $189,$249 total
Wyndham Garden Chinatown,The price is $189,$220 total
Tarrytown House Estate on the Hudson,The price is $189,$236 total
Marco LaGuardia Hotel,The price is $189,$220 total
"Holiday Inn Express New York City- Wall Street, an IHG Hotel",The price is $189,$240 total
La Quinta Inn & Suites by Wyndham Clifton/Rutherford,The price is $189,$217 total
"Holiday Inn Express Laguardia Airport, an IHG Hotel",The price is $189,$222 total
"Hotel Indigo Williamsburg - Brooklyn, an IHG Hotel",The price is $191,$259 total
"Club Quarters Hotel, World Trade Center",The price is $191,$223 total
World Center Hotel,The price is $191,$223 total
Hyatt Grand Central New York,The price is $192,$270 total
Hyatt Centric Wall Street New York,The price is $192,$253 total
Hyatt Place Long Island City/New York City,The price is $193,$225 total
The Andrew Hotel,The price is $193,$216 total
"Martinique New York on Broadway, Curio Collection by Hilton",The price is $195,$273 total
Penny Williamsburg,The price is $195,$249 total
Hilton Garden Inn Ridgefield Park,The price is $195,$223 total
"Club Quarters, Times Square - Midtown",The price is $195,$227 total
The Grand Summit Hotel,The price is $195,$224 total
Moxy NYC Lower East Side,The price is $195,$257 total
Arlo NoMad,The price is $196,$258 total
Embassy Suites by Hilton New York Manhattan Times Square,The price is $196,$259 total
"Candlewood Suites New York City-Times Square, an IHG Hotel",The price is $197,$249 total
"Holiday Inn Express New York City Times Square, an IHG Hotel",The price is $197,$247 total
Four Points by Sheraton Manhattan SoHo Village,The price is $197,$230 total
Sheraton Tarrytown Hotel,The price is $197,$225 total
Best Western Premier NYC Gateway Hotel,The price is $198,$235 total
"Distrikt Hotel New York City, Tapestry Collection by Hilton",The price is $198,$254 total
"Insignia Hotel, Ascend Hotel Collection",The price is $198,$231 total
"Holiday Inn Express Manhattan Times Square South, an IHG Hotel",The price is $199,$231 total
Courtyard by Marriott West Orange,The price is $199,$228 total
The Leo House,The price is $199,$229 total
Aloft New York Brooklyn,The price is $199,$234 total
Westgate New York Grand Central,The price is $199,$270 total
Selina Chelsea,The price is $199,$254 total
Extended Stay America Suites White Plains Elmsford,The price is $199,$228 total
Chelsea Mews Guest House All Male,The price is $200,$233 total
The Williamsburg Hotel,The price is $200,$278 total
The Nolitan,The price is $200,$262 total
TownePlace Suites by Marriott New York Manhattan/Chelsea,The price is $202,$235 total
SpringHill Suites by Marriott New York Manhattan/Chelsea,The price is $202,$237 total
Fairfield Inn & Suites New York Manhattan/Times Square South,The price is $203,$237 total
"The Lexington Hotel, Autograph Collection",The price is $203,$272 total
Hampton Inn Manhattan-Chelsea,The price is $203,$237 total
Hotel 48LEX New York,The price is $204,$289 total
Hotel and the City-Midtown,The price is $204,$238 total
"The Jewel, a Club Quarters Hotel, Opposite Rockefeller Center",The price is $206,$240 total
Aloft New York Chelsea,The price is $206,$240 total
3 West Club,The price is $206,$240 total
Renaissance New York Chelsea Hotel,The price is $206,$275 total
Harmony Suites,The price is $206,$242 total
Best Western Plus Soho Hotel,The price is $206,$240 total
NH Collection New York Madison Avenue,The price is $207,$276 total
INNSiDE by Meliá New York Nomad,The price is $207,$281 total
Sonesta Simply Suites Jersey City,The price is $207,$241 total
Sheraton Lincoln Harbor Hotel,The price is $208,$238 total
"Holiday Inn NYC - Lower East Side, an IHG Hotel",The price is $208,$244 total
Ramada by Wyndham Bronx,The price is $208,$242 total
The Westin New York Grand Central,The price is $209,$278 total
Five Towns Inn - JFK Airport,The price is $209,$233 total
The Belvedere Hotel,The price is $209,$268 total
"Crowne Plaza HY36 Midtown Manhattan, an IHG Hotel",The price is $209,$274 total
The Renwick,The price is $209,$273 total
Motto by Hilton New York City Chelsea,The price is $209,$277 total
The Hoxton Williamsburg,The price is $209,$243 total
Hilton New York Fashion District,The price is $209,$243 total
Fairfield Inn & Suites New York Manhattan / Central Park,The price is $210,$245 total
SpringHill Suites by Marriott New York Manhattan/Times Square South,The price is $210,$247 total
Hampton Inn Madison Square Garden Area Hotel,The price is $210,$245 total
Doubletree by Hilton New York Times Square South,The price is $211,$245 total
The James New York - NoMad,The price is $212,$292 total
Arlo Midtown,The price is $212,$275 total
Hotel Hendricks,The price is $212,$281 total
The Lucerne Hotel,The price is $212,$246 total
Moxy NYC Downtown,The price is $212,$275 total
Hampton Inn Manhattan/Times Square South,The price is $215,$250 total
The New Yorker A Wyndham Hotel,The price is $216,$285 total
Hilton Garden Inn New York/Manhattan-Midtown East,The price is $217,$252 total
Residence Inn Orangeburg,The price is $218,$242 total
"Holiday Inn Express Kennedy Airport, an IHG Hotel",The price is $218,$255 total
Hilton Garden Inn New York/Tribeca,The price is $218,$254 total
Homewood Suites New York/Midtown Manhattan Times Square,The price is $218,$254 total
"Hotel Indigo Lower East Side New York, an IHG Hotel",The price is $219,$293 total
Mondrian Park Avenue,The price is $219,$291 total
The Evelyn Hotel,The price is $219,$286 total
Residence Inn Marriott New York Downtown Manhattan/WTC Area,The price is $219,$257 total
Fairfield Inn & Suites by Marriott New York ManhattanChelsea,The price is $219,$255 total
Teaneck Marriott at Glenpointe,The price is $219,$251 total
Hotel 57,The price is $219,$301 total
"The Bernic Hotel New York City, Tapestry Collection by Hilton",The price is $220,$256 total
Hotel Hayden,The price is $220,$306 total
Grayson Hotel in the Unbound Collection by Hyatt,The price is $221,$294 total
The Michelangelo Hotel,The price is $224,$306 total
"PUBLIC, an Ian Schrager hotel",The price is $225,$302 total
Dream Downtown,The price is $225,$312 total
Pestana Park Avenue,The price is $225,$285 total
Iberostar 70 Park Avenue,The price is $225,$287 total
Hampton Inn NY-JFK,The price is $226,$263 total
OYO Times Square,The price is $227,$307 total
"Holiday Inn Express - New York City Chelsea, an IHG Hotel",The price is $227,$283 total
Renaissance New York Harlem Hotel,The price is $228,$294 total
AC Hotel by Marriott New York Downtown,The price is $229,$266 total
Hotel On Rivington,The price is $229,$300 total
Radisson Hotel New Rochelle,The price is $229,$274 total
Hotel Edison Times Square,The price is $229,$306 total
Hotel Belleclaire,The price is $229,$290 total
Hotel Scherman,The price is $229,$266 total
"Vista LIC Hotel, BW Premier Collection",The price is $229,$266 total
"voco The Franklin New York, an IHG Hotel",The price is $229,$280 total
Hampton Inn Manhattan-35th St/Empire State Bldg,The price is $229,$266 total
Residence Inn Secaucus Meadowlands,The price is $229,$269 total
Millennium Hotel Broadway Times Square,The price is $230,$331 total
The Pearl New York,The price is $230,$302 total
The Kitano Hotel New York,The price is $232,$270 total
Royalton Park Avenue,The price is $233,$317 total
"Holiday Inn Manhattan 6th Ave - Chelsea, an IHG Hotel",The price is $233,$273 total
Courtyard by Marriott Edgewater NYC Area,The price is $234,$268 total
Hilton Garden Inn New York/Manhattan-Chelsea,The price is $234,$272 total
Hyatt Place Flushing/LaGuardia Airport,The price is $235,$273 total
The Sohotel,The price is $236,$294 total
Moxy NYC East Village,The price is $237,$305 total
"Crowne Plaza JFK Airport New York City, an IHG Hotel",The price is $237,$277 total
Hyatt House New York/Chelsea,The price is $237,$279 total
The MUSE New York,The price is $237,$310 total
SIXTY Lower East Side,The price is $237,$314 total
Pestana CR7 Times Square,The price is $238,$301 total
Hilton Garden Inn New York Times Square North,The price is $238,$277 total
Kixby,The price is $239,$301 total
CIVILIAN Hotel,The price is $239,$278 total
Executive Hotel Le Soleil New York,The price is $239,$293 total
citizenM New York Bowery,The price is $239,$278 total
The Ludlow Hotel,The price is $239,$278 total
The Westin New York at Times Square,The price is $239,$312 total
The Life Hotel,The price is $239,$328 total
The Holland Hotel,The price is $239,$279 total
Rockville Centre Hotel,The price is $240,$268 total
"Gild Hall, A Thompson Hotel",The price is $240,$334 total
Washington Square Hotel,The price is $241,$280 total
Truss Hotel Times Square ,The price is $242,$281 total
Element New York Times Square West,The price is $242,$281 total
Hilton New York Times Square,The price is $246,$326 total
The Manhattan Club,The price is $247,$289 total
Hilton Garden Inn New York/Times Square Central,The price is $247,$312 total
"Le Meridien New York, Fifth Avenue",The price is $248,$288 total
Madison LES Hotel,The price is $248,$312 total
Ace Hotel New York,The price is $249,$329 total
"voco Times Square South, an IHG Hotel",The price is $249,$291 total
citizenM New York Times Square,The price is $249,$289 total
Ace Hotel Brooklyn,The price is $249,$314 total
Casa Blanca Hotel Brooklyn,The price is $249,$289 total
The Box House Hotel,The price is $249,$289 total
NoMo SoHo,The price is $249,$339 total
Four Points by Sheraton Flushing,The price is $251,$292 total
"Envue, Autograph Collection",The price is $251,$288 total
Arthouse Hotel New York City,The price is $254,$340 total
Four Points By Sheraton Manhattan Midtown West,The price is $254,$295 total
Dream Midtown,The price is $257,$331 total
HI New York City,The price is $258,$258 total
Courtyard by Marriott New York Manhattan/Upper East Side,The price is $259,$301 total
Pod Brooklyn,The price is $259,$324 total
Allegria Hotel,The price is $259,$339 total
Ramada by Wyndham Flushing Queens,The price is $259,$301 total
Wingate by Wyndham Bronx/Haven Park,The price is $259,$301 total
Smyth Tribeca,The price is $260,$353 total
The Rockaway Hotel,The price is $260,$351 total
Archer Hotel New York,The price is $260,$302 total
Four Points by Sheraton Midtown-Times Square,The price is $260,$302 total
Hilton Garden Inn New York/Central Park South-Midtown West,The price is $260,$305 total
Renaissance New York Flushing Hotel at Tangram,The price is $260,$302 total
Moxy NYC Chelsea,The price is $260,$332 total
Millennium Premier New York Times Square,The price is $261,$378 total
CODA Williamsburg,The price is $261,$361 total
Arlo SoHo,The price is $263,$334 total
The Marmara Park Avenue,The price is $263,$368 total
Courtyard Westbury Long Island,The price is $263,$293 total
Courtyard by Marriott New York Manhattan / Chelsea,The price is $263,$305 total
The Bryant Park Hotel,The price is $265,$340 total
Fitzpatrick Manhattan Hotel,The price is $268,$334 total
SpringHill Suites by Marriott New York Midtown Manhattan,The price is $268,$311 total
Carnegie Hotel,The price is $269,$370 total
Concorde Hotel New York,The price is $269,$337 total
Renaissance New York Times Square Hotel,The price is $269,$347 total
"Holiday Inn New York City - Times Square, an IHG Hotel",The price is $269,$314 total
