Hotel Name,Advertised Price,Total Price
Days Inn by Wyndham Wayne,The price is $77,$88 total
Days Inn by Wyndham Iselin / Woodbridge,The price is $77,$89 total
Tides Motor Inn at Stehli Beach,The price is $79,$88 total
Rodeway Inn Capri,The price is $85,$100 total
Bowery Grand Hotel,The price is $89,$106 total
Ramada by Wyndham East Orange,The price is $93,$104 total
Super 8 by Wyndham Meadowlands,The price is $95,$112 total
Hotel Executive Suites,The price is $98,$112 total
Days Inn by Wyndham Nanuet / Spring Valley,The price is $99,$110 total
The Central Park North,The price is $99,$117 total
Howard Johnson Hotel by Wyndham Newark Airport,The price is $99,$114 total
Extended Stay America Suites Ramsey Upper Saddle River,The price is $100,$114 total
La Quinta Inn & Suites by Wyndham Fairfield NJ,The price is $101,$116 total
Best Western The Inn At Ramsey,The price is $101,$116 total
Days Hotel by Wyndham North Bergen /NYC Area,The price is $101,$119 total
Red Roof Inn PLUS+ Newark Liberty Airport - Carteret,The price is $105,$121 total
Ramada by Wyndham Rochelle Park Near Paramus,The price is $109,$125 total
Travelodge by Wyndham Manhasset,The price is $110,$123 total
Horizon Inn,The price is $110,$126 total
Grandview Hotel New York,The price is $110,$130 total
Howard Johnson by Wyndham North Bergen,The price is $111,$130 total
The Park Ave North,The price is $115,$135 total
Super 8 by Wyndham Long Island City LGA Hotel,The price is $116,$137 total
Best Western Queens Court Hotel,The price is $119,$140 total
Feather Factory,The price is $119,$140 total
Knights Inn Brooklyn Sunset Park,The price is $119,$144 total
Chelsea Inn,The price is $122,$212 total
Best Western Brooklyn-Coney Island Inn,The price is $122,$144 total
La Quinta Inn & Suites by Wyndham Clifton/Rutherford,The price is $123,$140 total
Extended Stay America Suites Newark Woodbridge,The price is $123,$142 total
Red Roof Inn PLUS+ Secaucus - Meadowlands - NYC,The price is $125,$147 total
Paris Suites Hotel,The price is $125,$147 total
The Floral Park Motor Lodge,The price is $126,$144 total
"Holiday Inn Express Hotel & Suites Meadowlands Area, an IHG Hotel",The price is $126,$148 total
Comfort Inn Paramus,The price is $127,$145 total
Days Inn by Wyndham Ridgefield NJ,The price is $128,$150 total
Ramada by Wyndham Staten Island,The price is $128,$150 total
Quality Suites NYC Gateway,The price is $128,$150 total
Howard Johnson by Wyndham Clifton NJ,The price is $128,$147 total
Red Roof Inn Fairfield,The price is $130,$149 total
Best Western Plus Newark Airport West,The price is $133,$153 total
Extended Stay America Suites Meadowlands Rutherford,The price is $133,$156 total
Extended Stay America Suites Elizabeth Newark Airport,The price is $133,$156 total
Fairfield Inn by Marriott East Rutherford Meadowlands,The price is $134,$158 total
Hampton Inn & Suites Newark Airport Elizabeth,The price is $135,$159 total
Wyndham Garden North Bergen Near Secaucus,The price is $135,$159 total
Best Western Jamaica Inn,The price is $136,$160 total
Mitchell Executive Hotel,The price is $137,$157 total
TRYP by Wyndham Newark Downtown,The price is $138,$159 total
Meadowlands Plaza Hotel,The price is $139,$163 total
Opera House Hotel,The price is $139,$180 total
Ardsley Acres Hotel Westchester,The price is $139,$159 total
Ramada by Wyndham Yonkers / Westchester,The price is $139,$160 total
Liberty View Brooklyn hotel,The price is $143,$168 total
Best Western Queens Gold Coast,The price is $144,$168 total
TRYP by Wyndham New York City Times Square / Midtown,The price is $144,$191 total
Orchard Street Hotel,The price is $144,$183 total
Hampton Inn & Suites Teaneck Glenpointe,The price is $144,$165 total
Hyatt Place Fair Lawn Paramus,The price is $144,$165 total
Residence Inn by Marriott East Rutherford Meadowlands,The price is $144,$169 total
"Holiday Inn Hasbrouck Heights-Meadowlands, an IHG Hotel",The price is $144,$165 total
Courtyard by Marriott Newark Liberty International Airport,The price is $144,$166 total
Ramada by Wyndham Jersey City,The price is $146,$170 total
The Shoreham Hotel,The price is $149,$186 total
Sonesta Simply Suites Nanuet,The price is $149,$166 total
Airway Inn at LaGuardia,The price is $149,$174 total
Ramada by Wyndham Rockville Centre,The price is $150,$168 total
"Avion Inn Near LGA Airport, Ascend Hotel Collection",The price is $152,$178 total
Extended Stay America Suites Secaucus Meadowlands,The price is $152,$179 total
Fairfield Inn & Suites Newark Liberty International Airport,The price is $152,$175 total
Marriott Saddle Brook,The price is $152,$174 total
La Quinta Inn & Suites by Wyndham Secaucus Meadowlands,The price is $152,$179 total
Casa Azul Hotel Blu JFK,The price is $152,$190 total
"The Westfield Inn, BW Signature Collection",The price is $152,$170 total
Wyndham Garden LaGuardia South,The price is $152,$178 total
La Quinta Inn & Suites by Wyndham New York City Central Park,The price is $153,$212 total
Hilton Meadowlands,The price is $156,$184 total
Freehand New York,The price is $158,$219 total
Royal Regency Hotel,The price is $158,$191 total
Quality Inn JFK Airport Rockaway Blvd,The price is $158,$188 total
Red Carpet Inn Elmwood Park,The price is $158,$182 total
Radisson Hotel JFK Airport,The price is $159,$186 total
Midtown West Hotel,The price is $159,$201 total
Asiatic Hotel by LaGuardia Airport,The price is $159,$186 total
The Lex NYC,The price is $161,$221 total
Hampton Inn Carlstadt-At The Meadowlands,The price is $161,$189 total
Fairfield Inn & Suites by Marriott Paramus,The price is $161,$185 total
Extended Stay America Suites Meadowlands East Rutherford,The price is $161,$190 total
"Holiday Inn Express Ramsey-Mahwah, an IHG Hotel",The price is $162,$186 total
The Ridge Hotel,The price is $162,$259 total
SpringHill Suites by Marriott Newark Liberty International,The price is $163,$187 total
"Holiday Inn Express Newark Airport Elizabeth, an IHG Hotel",The price is $165,$189 total
"Holiday Inn Express New York - Manhattan West Side, an IHG Hotel",The price is $165,$195 total
Radio Hotel,The price is $166,$194 total
The Solita Soho Hotel,The price is $169,$220 total
Heritage Hotel,The price is $169,$197 total
Adria Hotel And Conference Center,The price is $169,$197 total
Best Western Plus Fairfield Executive Inn,The price is $169,$194 total
The Parc Hotel,The price is $169,$198 total
Home2 Suites by Hilton Newark Airport,The price is $169,$195 total
Midtown Convention Center Hotel,The price is $170,$214 total
Fairfield Inn & Suites New York Queens/Fresh Meadows,The price is $170,$199 total
Best Western Mill River Manor,The price is $170,$190 total
Sheraton Lincoln Harbor Hotel,The price is $170,$195 total
The Brooklyn,The price is $170,$221 total
Wheeler Hotel,The price is $170,$199 total
Hampton Inn Nanuet,The price is $174,$194 total
Red Roof PLUS+ Long Island - Garden City,The price is $174,$194 total
Hilton Short Hills,The price is $174,$200 total
Courtyard by Marriott New York Downtown Manhattan/Financial District,The price is $175,$204 total
SpringHill Suites by Marriott Tarrytown Westchester County,The price is $175,$200 total
Best Western Gregory Hotel,The price is $175,$205 total
Extended Stay America Suites New York City LaGuardia Airport,The price is $176,$205 total
Hyatt Place Fort Lee / George Washington Bridge,The price is $176,$202 total
The Kenilworth,The price is $177,$203 total
YMCA West Side,The price is $178,$178 total
SoHo 54 Hotel,The price is $179,$243 total
Off Soho Suites Hotel,The price is $179,$211 total
Lic Plaza Hotel,The price is $179,$209 total
Sleepy Hollow Hotel,The price is $179,$205 total
Best Western Paramus Hotel & Suites,The price is $179,$205 total
Hyatt Place Secaucus/Meadowlands,The price is $179,$211 total
Fairfield Inn by Marriott JFK Airport,The price is $179,$209 total
"Crowne Plaza Englewood, an IHG Hotel",The price is $179,$205 total
La Quinta Inn & Suites by Wyndham Garden City,The price is $180,$200 total
Comfort Suites Newark - Harrison,The price is $180,$207 total
Extended Stay America Suites Secaucus New York City Area,The price is $180,$212 total
Best Western Fort Lee,The price is $181,$209 total
Comfort Inn JFK Airport,The price is $181,$212 total
The Flat NYC,The price is $185,$215 total
LIC Hotel,The price is $185,$216 total
Fairfield Inn New York Manhattan/Financial District,The price is $186,$217 total
Residence Inn by Marriott New York Downtown Manhattan/Financial District,The price is $186,$217 total
Hilton Garden Inn Roslyn,The price is $186,$208 total
Hampton Inn Manhattan-Seaport-Financial District,The price is $187,$218 total
Hampton Inn Newark Airport,The price is $187,$216 total
Hotel Mimosa,The price is $188,$219 total
Broadway Plaza Hotel,The price is $188,$231 total
Artezen Hotel,The price is $188,$235 total
Westminster Hotel,The price is $188,$216 total
Fairfield Inn & Suites by Marriott North Bergen,The price is $188,$221 total
"Crowne Plaza Newark Airport, an IHG Hotel",The price is $188,$216 total
"Club Quarters, Times Square - Midtown",The price is $189,$220 total
Marco LaGuardia Hotel,The price is $189,$220 total
Courtyard by Marriott Edgewater NYC Area,The price is $189,$217 total
Aloft Long Island City - Manhattan View,The price is $189,$220 total
"Hotel Indigo NYC Financial District, an IHG Hotel",The price is $189,$222 total
"Holiday Inn Express Laguardia Airport, an IHG Hotel",The price is $189,$222 total
Ravel Hotel Trademark Collection by Wyndham,The price is $190,$222 total
Aloft Manhattan Downtown - Financial District,The price is $191,$222 total
Hyatt Herald Square New York,The price is $193,$247 total
Teaneck Marriott at Glenpointe,The price is $193,$221 total
Courtyard by Marriott New York Manhattan / Chelsea,The price is $193,$225 total
The Andrew Hotel,The price is $193,$216 total
The Lodge Red Hook,The price is $194,$226 total
Courtyard by Marriott New York Queens/Fresh Meadows,The price is $194,$226 total
La Quinta Inn & Suites by Wyndham Times Square South,The price is $195,$249 total
Hilton Garden Inn Ridgefield Park,The price is $195,$223 total
The Grand Summit Hotel,The price is $195,$224 total
"The L Hotel, Ascend Hotel Collection",The price is $197,$229 total
Courtyard by Marriott Yonkers Westchester County,The price is $197,$226 total
Paramount Times Square,The price is $197,$270 total
Moderne Hotel,The price is $197,$253 total
Sheraton Tarrytown Hotel,The price is $197,$225 total
"Viana Hotel and Spa, Trademark Collection by Wyndham",The price is $197,$220 total
Best Western Premier NYC Gateway Hotel,The price is $198,$235 total
Hotel Richland LES,The price is $198,$251 total
"Insignia Hotel, Ascend Hotel Collection",The price is $198,$231 total
Courtyard by Marriott West Orange,The price is $199,$228 total
Hyatt Place New York/Chelsea,The price is $199,$232 total
Residence Inn By Marriott New Rochelle,The price is $199,$228 total
The Fifty Sonesta Select New York,The price is $199,$279 total
The Gotham Hotel,The price is $199,$260 total
Extended Stay America Suites White Plains Elmsford,The price is $199,$228 total
Chelsea Mews Guest House All Male,The price is $200,$233 total
DoubleTree by Hilton Hotel Newark Airport,The price is $201,$232 total
Sonesta White Plains Downtown,The price is $202,$252 total
The Gatsby Hotel,The price is $203,$273 total
"Staypineapple, An Artful Hotel, Midtown",The price is $203,$265 total
"Hotel Nyack, a JdV by Hyatt Hotel",The price is $203,$283 total
SpringHill Suites by Marriott New York Midtown Manhattan,The price is $205,$239 total
Comfort Inn Prospect Park - Brooklyn,The price is $205,$239 total
"Envue, Autograph Collection",The price is $206,$236 total
Residence Inn by Marriott Newark Elizabeth/Liberty International Airport,The price is $206,$241 total
Element Harrison - Newark,The price is $206,$236 total
Hotel St. James,The price is $206,$240 total
OYO Times Square,The price is $206,$284 total
"Holiday Inn New York City - Times Square, an IHG Hotel",The price is $206,$242 total
Harmony Suites,The price is $206,$242 total
Ramada by Wyndham Bronx,The price is $207,$241 total
Wyndham Garden Brooklyn Sunset Park,The price is $209,$253 total
Five Towns Inn - JFK Airport,The price is $209,$233 total
Wyndham Garden Chinatown,The price is $209,$243 total
The Manhattan at Times Square Hotel,The price is $209,$284 total
Arlo Midtown,The price is $212,$275 total
"Club Quarters Hotel, World Trade Center",The price is $212,$247 total
World Center Hotel,The price is $212,$247 total
Moxy NYC Downtown,The price is $212,$275 total
Placemakr Wall Street,The price is $214,$351 total
Empire Hotel,The price is $215,$273 total
Millennium Downtown New York,The price is $215,$285 total
Henn na Hotel New York,The price is $215,$273 total
The Allen Hotel,The price is $216,$280 total
HGU New York,The price is $217,$252 total
The Nolitan,The price is $218,$282 total
Residence Inn Orangeburg,The price is $218,$242 total
"Holiday Inn Express Kennedy Airport, an IHG Hotel",The price is $218,$255 total
Mondrian Park Avenue,The price is $219,$291 total
Doubletree by Hilton New York Times Square South,The price is $220,$256 total
Embassy Suites by Hilton New York Manhattan Times Square,The price is $220,$286 total
Leon Hotel LES,The price is $221,$282 total
Millennium Hotel Broadway Times Square,The price is $221,$322 total
"Hotel Indigo - NYC Downtown - Wall Street, an IHG Hotel",The price is $221,$288 total
Comfort Inn Manhattan - Midtown West,The price is $223,$259 total
The Shelburne Sonesta New York,The price is $224,$305 total
"Holiday Inn Express New York City Times Square, an IHG Hotel",The price is $224,$278 total
The Michelangelo Hotel,The price is $224,$306 total
Iberostar 70 Park Avenue,The price is $225,$287 total
Hilton Garden Inn New York/West 35th Street,The price is $226,$262 total
TownePlace Suites by Marriott New York Manhattan/Chelsea,The price is $228,$265 total
SpringHill Suites by Marriott New York Manhattan/Chelsea,The price is $228,$267 total
DoubleTree by Hilton New York Midtown Fifth Ave,The price is $228,$266 total
Hotel On Rivington,The price is $229,$300 total
CIVILIAN Hotel,The price is $229,$266 total
Hotel 48LEX New York,The price is $229,$318 total
"Vista LIC Hotel, BW Premier Collection",The price is $229,$266 total
Hyatt Place New York/Yonkers,The price is $229,$263 total
Residence Inn Secaucus Meadowlands,The price is $229,$269 total
Hotel 57,The price is $229,$313 total
Pestana CR7 Times Square,The price is $230,$293 total
"Club Quarters Hotel, Grand Central",The price is $231,$269 total
Hotel Boutique at Grand Central,The price is $231,$269 total
Hampton Inn NY-JFK,The price is $233,$271 total
Four Points by Sheraton Manhattan SoHo Village,The price is $233,$271 total
Cambria Hotel New York - Chelsea,The price is $234,$272 total
"The Time New York, part of JdV by Hyatt",The price is $234,$306 total
Four Points By Sheraton New York Downtown,The price is $234,$272 total
Hampton Inn Manhattan Grand Central,The price is $235,$273 total
"EVEN Hotel Brooklyn, an IHG Hotel",The price is $237,$292 total
"Crowne Plaza JFK Airport New York City, an IHG Hotel",The price is $237,$277 total
The Lucerne Hotel,The price is $237,$276 total
"The Lexington Hotel, Autograph Collection",The price is $237,$311 total
Hyatt Grand Central New York,The price is $238,$323 total
Hyatt Centric Wall Street New York,The price is $238,$306 total
Hotel Edison Times Square,The price is $239,$318 total
The New Yorker A Wyndham Hotel,The price is $239,$311 total
The Holland Hotel,The price is $239,$279 total
The One Boutique Hotel,The price is $239,$278 total
Hilton Garden Inn New York/Midtown Park Ave,The price is $239,$278 total
Rockville Centre Hotel,The price is $240,$268 total
RIU Plaza Manhattan Times Square,The price is $240,$313 total
Washington Square Hotel,The price is $241,$280 total
Best Western Plus Soho Hotel,The price is $242,$281 total
"Hotel Indigo Williamsburg - Brooklyn, an IHG Hotel",The price is $243,$318 total
Wingate by Wyndham New York Midtown South/5th Ave,The price is $243,$282 total
Fairfield Inn & Suites by Marriott New York ManhattanChelsea,The price is $246,$285 total
NU Hotel Brooklyn,The price is $246,$302 total
Renaissance New York Harlem Hotel,The price is $246,$314 total
"Holiday Inn Express Manhattan Times Square South, an IHG Hotel",The price is $246,$286 total
Park Central Hotel New York,The price is $247,$331 total
Selina Chelsea,The price is $247,$309 total
"voco The Franklin New York, an IHG Hotel",The price is $247,$301 total
"The Bernic Hotel New York City, Tapestry Collection by Hilton",The price is $247,$287 total
Fitzpatrick Grand Central,The price is $248,$311 total
Madison LES Hotel,The price is $248,$312 total
The Westin New York Grand Central,The price is $249,$324 total
Home2 Suites By Hilton New York Times Square,The price is $249,$289 total
The Belvedere Hotel,The price is $249,$314 total
Ace Hotel New York,The price is $249,$329 total
Hotel Mulberry,The price is $249,$289 total
Hilton Garden Inn New York/Times Square Central,The price is $249,$314 total
Casa Blanca Hotel Brooklyn,The price is $249,$289 total
The Box House Hotel,The price is $249,$289 total
6 Columbus Central Park Hotel,The price is $250,$325 total
New York Hilton Midtown,The price is $251,$326 total
Four Points by Sheraton Flushing,The price is $251,$292 total
Sofitel New York,The price is $251,$321 total
"Gild Hall, A Thompson Hotel",The price is $251,$346 total
Four Points by Sheraton Midtown-Times Square,The price is $252,$292 total
Millennium Premier New York Times Square,The price is $252,$368 total
YOTEL New York Times Square,The price is $254,$338 total
DoubleTree by Hilton Hotel & Suites Jersey City,The price is $254,$296 total
Hotel Belleclaire,The price is $255,$320 total
Eurostars Wall Street,The price is $255,$296 total
"Holiday Inn NYC - Lower East Side, an IHG Hotel",The price is $256,$299 total
Arlo NoMad,The price is $256,$326 total
Grayson Hotel in the Unbound Collection by Hyatt,The price is $257,$336 total
"Park South Hotel, part of JdV by Hyatt",The price is $257,$332 total
Hampton Inn Manhattan-35th St/Empire State Bldg,The price is $257,$298 total
Hampton Inn Brooklyn/Downtown,The price is $257,$299 total
HI New York City,The price is $258,$258 total
"voco Times Square South, an IHG Hotel",The price is $259,$303 total
citizenM New York Times Square,The price is $259,$301 total
Allegria Hotel,The price is $259,$339 total
Ramada by Wyndham Flushing Queens,The price is $259,$301 total
Hotel Riu Plaza New York Times Square,The price is $259,$334 total
NoMo SoHo,The price is $259,$350 total
Penny Williamsburg,The price is $259,$323 total
Sonesta Simply Suites Jersey City,The price is $260,$303 total
Moxy NYC Times Square,The price is $260,$336 total
Renaissance New York Flushing Hotel at Tangram,The price is $260,$302 total
Arlo SoHo,The price is $263,$334 total
The Marmara Park Avenue,The price is $263,$368 total
Courtyard Westbury Long Island,The price is $263,$293 total
Moxy NYC Lower East Side,The price is $263,$335 total
Red Lion Inn & Suites Long Island City,The price is $263,$305 total
Moxy NYC East Village,The price is $265,$338 total
DoubleTree by Hilton Hotel New York City - Chelsea,The price is $265,$308 total
Motto by Hilton New York City Chelsea,The price is $266,$343 total
DoubleTree by Hilton New York Times Square West,The price is $267,$309 total
"Holiday Inn Express & Suites Jersey City North - Hoboken, an IHG Hotel",The price is $268,$313 total
Margaritaville Resort Times Square,The price is $268,$369 total
citizenM New York Bowery,The price is $269,$312 total
Hyatt Place New York City/Times Square,The price is $269,$312 total
The Manhattan Club,The price is $269,$314 total
Renaissance New York Times Square Hotel,The price is $269,$347 total
Aloft New York Chelsea,The price is $269,$312 total
Tarrytown House Estate on the Hudson,The price is $269,$328 total
Truss Hotel Times Square ,The price is $269,$312 total
The James New York - NoMad,The price is $269,$358 total
The Boro Hotel,The price is $269,$334 total
Hampton Inn Madison Square Garden Area Hotel,The price is $270,$314 total
Hyatt House Jersey City,The price is $271,$316 total
The Westin New York at Times Square,The price is $271,$349 total
Hotel Beacon,The price is $271,$317 total
"Distrikt Hotel New York City, Tapestry Collection by Hilton",The price is $275,$342 total
Dream Midtown,The price is $275,$352 total
Hilton Garden Inn New York/Manhattan-Midtown East,The price is $277,$322 total
Aliz Hotel Times Square,The price is $278,$357 total
The Garden City Hotel,The price is $278,$338 total
Hotel Elysee by Library Hotel Collection,The price is $279,$348 total
The Frederick Hotel,The price is $279,$355 total
Hotel Scherman,The price is $279,$351 total
Redford Hotel,The price is $279,$339 total
Courtyard by Marriott New York Manhattan/Upper East Side,The price is $279,$324 total
Aloft New York Brooklyn,The price is $279,$326 total
Westgate New York Grand Central,The price is $279,$362 total
Best Western Premier Empire State Hotel,The price is $280,$325 total
The Lombardy Hotel,The price is $280,$336 total
Refinery Hotel,The price is $281,$372 total
"Hotel 50 Bowery, part of JdV by Hyatt",The price is $282,$362 total
Hilton Garden Inn New York/Tribeca,The price is $282,$327 total
Hampton Inn Manhattan-Chelsea,The price is $282,$327 total
Hampton Inn New York Times Square,The price is $282,$327 total
Hampton Inn Manhattan/Downtown-Financial District,The price is $282,$327 total
Royalton New York,The price is $283,$368 total
Hyatt Place Flushing/LaGuardia Airport,The price is $283,$328 total
DoubleTree by Hilton New York Downtown,The price is $283,$328 total
"Holiday Inn Express - New York City Chelsea, an IHG Hotel",The price is $284,$349 total
"Holiday Inn Express Brooklyn - Bushwick, an IHG Hotel",The price is $284,$349 total
Hilton New York Times Square,The price is $284,$370 total
"Holiday Inn Express & Suites Jersey City - Holland Tunnel, an IHG Hotel",The price is $285,$332 total
Corona Hotel,The price is $285,$331 total
Hyatt Centric Times Square New York,The price is $287,$373 total
"Holiday Inn Manhattan 6th Ave - Chelsea, an IHG Hotel",The price is $287,$335 total
"The Jewel, a Club Quarters Hotel, Opposite Rockefeller Center",The price is $288,$334 total
Pod 51,The price is $289,$358 total
"InterContinental New York Barclay, an IHG Hotel",The price is $289,$382 total
Condor Hotel,The price is $289,$335 total
Wingate by Wyndham Bronx/Haven Park,The price is $289,$335 total
Park Terrace Hotel,The price is $293,$340 total
The Kitano Hotel New York,The price is $294,$341 total
Concorde Hotel New York,The price is $296,$368 total
Dylan Hotel NYC,The price is $296,$360 total
HYATT house White Plains,The price is $297,$339 total
Sheraton New York Times Square Hotel,The price is $297,$374 total
"The Draper New York, Tapestry Collection by Hilton",The price is $297,$344 total
Radisson Hotel New Rochelle,The price is $298,$356 total
"Hotel Indigo Lower East Side New York, an IHG Hotel",The price is $299,$385 total
"InterContinental New York Times Square, an IHG Hotel",The price is $299,$389 total
AC Hotel by Marriott New York Times Square,The price is $299,$347 total
Inn at Great Neck,The price is $299,$334 total
Hyatt Regency JFK Airport at Resorts World New York,The price is $299,$375 total
Franklin Guesthouse,The price is $299,$347 total
Kixby,The price is $304,$375 total
Renaissance New York Chelsea Hotel,The price is $305,$389 total
SIXTY Lower East Side,The price is $305,$392 total
INNSiDE by Meliá New York Nomad,The price is $306,$395 total
Hyatt House New York/Chelsea,The price is $307,$360 total
Edge Hotel,The price is $307,$356 total
Hyatt Regency Jersey City on the Hudson,The price is $308,$359 total
"Martinique New York on Broadway, Curio Collection by Hilton",The price is $308,$403 total
Executive Hotel Le Soleil New York,The price is $309,$373 total
The Hotel @ Fifth Avenue,The price is $309,$378 total
"EVEN Midtown East Grand Central, an IHG Hotel",The price is $309,$385 total
Hyatt Place Long Island City/New York City,The price is $309,$358 total
AC Hotel by Marriott New York Downtown,The price is $310,$359 total
Tempo by Hilton New York Times Square,The price is $310,$359 total
Jazz On The Park Hostel,The price is $310,$359 total
WestHouse New York,The price is $311,$487 total
Hilton Garden Inn New York Times Square North,The price is $312,$361 total
Hilton Club The Quin New York,The price is $314,$363 total
Pestana CR7 Times Square,The price is $314,$314 total
Courtyard New York Manhattan/Times Square West,The price is $314,$364 total
Library Hotel by Library Hotel Collection,The price is $314,$389 total
W New York - Times Square,The price is $316,$391 total
The Iroquois New York,The price is $319,$401 total
The William Vale,The price is $320,$411 total
"The Algonquin Hotel Times Square, Autograph Collection",The price is $322,$403 total
Courtyard by Marriott New York Manhattan/SoHo,The price is $323,$374 total
Hilton New York Fashion District,The price is $325,$377 total
Best Western Plus Hospitality House,The price is $326,$377 total
Fitzpatrick Manhattan Hotel,The price is $328,$403 total
"PUBLIC, an Ian Schrager hotel",The price is $329,$421 total
The Standard East Village,The price is $329,$415 total
The Pearl New York,The price is $330,$417 total
The Hilton Club - New York,The price is $331,$383 total
The Maritime Hotel,The price is $332,$384 total
The Ned NoMad,The price is $333,$424 total
The Williamsburg Hotel,The price is $333,$431 total
Virgin Hotels New York City,The price is $336,$427 total
Dream Downtown,The price is $338,$441 total
"Le Meridien New York, Central Park by Marriott",The price is $339,$393 total
Arthouse Hotel New York City,The price is $339,$437 total
Hilton Club The Central at 5th New York,The price is $339,$393 total
